,property,listing_title,is_sponsored,listing_id,listing_url,number_reviews,listing_rank,all_rank,common_icons,is_special_offer,from_rate
0,property,      Mercure Jakarta Pantai Indah Kapuk,False,13131262,https://www.tripadvisor.com/Hotel_Review-g294229-d13131262-Reviews-Mercure_Jakarta_Pantai_Indah_Kapuk-Jakarta_Java.html,552,1,"2,075",Free Wifi Free parking ,False,0
1,property,      Hotel Ciputra Jakarta,False,306745,https://www.tripadvisor.com/Hotel_Review-g294229-d306745-Reviews-Hotel_Ciputra_Jakarta-Jakarta_Java.html,1262,2,"2,075",Free Wifi Free parking ,False,0
2,property,      Shangri-La Hotel Jakarta,False,302122,https://www.tripadvisor.com/Hotel_Review-g294229-d302122-Reviews-Shangri_La_Hotel_Jakarta-Jakarta_Java.html,2584,3,"2,075",Free Wifi Free parking ,True,0
3,property,      Hotel Indonesia Kempinski,False,1156456,https://www.tripadvisor.com/Hotel_Review-g294229-d1156456-Reviews-Hotel_Indonesia_Kempinski-Jakarta_Java.html,1571,4,"2,075",Free Wifi Free parking ,False,0
4,property,      Grand Whiz Poins Square,False,10499376,https://www.tripadvisor.com/Hotel_Review-g294229-d10499376-Reviews-Grand_Whiz_Poins_Square-Jakarta_Java.html,1200,5,"2,075",Free Wifi Free parking ,False,0
5,property,      Swiss-Belresidences Kalibata,False,8139854,https://www.tripadvisor.com/Hotel_Review-g294229-d8139854-Reviews-Swiss_Belresidences_Kalibata-Jakarta_Java.html,573,6,"2,075",Free Wifi Free parking ,False,0
6,property,      All Sedayu Hotel Kelapa Gading,False,5518262,https://www.tripadvisor.com/Hotel_Review-g294229-d5518262-Reviews-All_Sedayu_Hotel_Kelapa_Gading-Jakarta_Java.html,1116,7,"2,075",Free Wifi Free parking ,False,0
7,property,      ARTOTEL Thamrin - Jakarta,False,5992269,https://www.tripadvisor.com/Hotel_Review-g294229-d5992269-Reviews-ARTOTEL_Thamrin_Jakarta-Jakarta_Java.html,1525,8,"2,075",Free Wifi Free parking ,False,0
8,property,      YELLO Hotel Harmoni,False,11831361,https://www.tripadvisor.com/Hotel_Review-g294229-d11831361-Reviews-YELLO_Hotel_Harmoni-Jakarta_Java.html,2460,9,"2,075",Free Wifi Free parking ,False,0
9,property,      Ascott Jakarta,False,584869,https://www.tripadvisor.com/Hotel_Review-g294229-d584869-Reviews-Ascott_Jakarta-Jakarta_Java.html,687,10,"2,075",Free Wifi Free parking ,False,0
10,property,      Kyriad Fatmawati Jakarta,False,13353908,https://www.tripadvisor.com/Hotel_Review-g294229-d13353908-Reviews-Kyriad_Fatmawati_Jakarta-Jakarta_Java.html,366,11,"2,075",Free Wifi Free parking ,False,0
11,property,      Posto Dormire Hotel Jakarta,False,15219400,https://www.tripadvisor.com/Hotel_Review-g294229-d15219400-Reviews-Posto_Dormire_Hotel_Jakarta-Jakarta_Java.html,139,12,"2,075",Free Wifi Free parking ,False,0
12,property,      Veranda Hotel at Pakubuwono,False,7319655,https://www.tripadvisor.com/Hotel_Review-g294229-d7319655-Reviews-Veranda_Hotel_at_Pakubuwono-Jakarta_Java.html,803,13,"2,075",Free Wifi Free parking ,False,0
13,property,      Four Seasons Hotel Jakarta,False,10447589,https://www.tripadvisor.com/Hotel_Review-g294229-d10447589-Reviews-Four_Seasons_Hotel_Jakarta-Jakarta_Java.html,709,14,"2,075",Free Wifi Free parking ,False,0
14,property,      The Jayakarta SP Jakarta Hotel & Spa,False,307146,https://www.tripadvisor.com/Hotel_Review-g294229-d307146-Reviews-The_Jayakarta_SP_Jakarta_Hotel_Spa-Jakarta_Java.html,139,15,"2,075",Free Wifi Free parking ,False,0
15,property,      Red Planet Jakarta Pasar Baru,False,3312754,https://www.tripadvisor.com/Hotel_Review-g294229-d3312754-Reviews-Red_Planet_Jakarta_Pasar_Baru-Jakarta_Java.html,617,16,"2,075",Free Wifi Free parking ,False,0
16,property,      Ascott Sudirman Jakarta,False,15212798,https://www.tripadvisor.com/Hotel_Review-g294229-d15212798-Reviews-Ascott_Sudirman_Jakarta-Jakarta_Java.html,170,17,"2,075",Free Wifi Free parking ,False,0
17,property,      Juno Hotel,False,12310520,https://www.tripadvisor.com/Hotel_Review-g294229-d12310520-Reviews-Juno_Hotel-Jakarta_Java.html,142,18,"2,075",Free Wifi Free parking ,False,0
18,property,      favehotel Kelapa Gading,False,4432823,https://www.tripadvisor.com/Hotel_Review-g294229-d4432823-Reviews-Favehotel_Kelapa_Gading-Jakarta_Java.html,423,19,"2,075",Free Wifi Free parking ,False,0
19,property,      Oakwood Apartments PIK Jakarta,False,20253643,https://www.tripadvisor.com/Hotel_Review-g294229-d20253643-Reviews-Oakwood_Apartments_PIK_Jakarta-Jakarta_Java.html,60,20,"2,075",Free Wifi Pool ,False,0
20,property,      favehotel Puri Indah Jakarta,False,6619981,https://www.tripadvisor.com/Hotel_Review-g294229-d6619981-Reviews-Favehotel_Puri_Indah_Jakarta-Jakarta_Java.html,256,21,"2,075",Free Wifi Restaurant ,False,0
21,property,"      Takes Hotel Jakarta, a PHM Collection",False,2278468,https://www.tripadvisor.com/Hotel_Review-g294229-d2278468-Reviews-Takes_Hotel_Jakarta_a_PHM_Collection-Jakarta_Java.html,227,22,"2,075",Free Wifi Free parking ,False,0
22,property,      Ra Premiere Simatupang,False,8489216,https://www.tripadvisor.com/Hotel_Review-g294229-d8489216-Reviews-Ra_Premiere_Simatupang-Jakarta_Java.html,132,23,"2,075",Free Wifi Free parking ,False,0
23,property,      Heef Hotel,False,12129948,https://www.tripadvisor.com/Hotel_Review-g294229-d12129948-Reviews-Heef_Hotel-Jakarta_Java.html,152,24,"2,075",Free Wifi Free parking ,False,0
24,property,      RedDoorz @ Jalan Pemuda,False,11835740,https://www.tripadvisor.com/Hotel_Review-g294229-d11835740-Reviews-RedDoorz_Jalan_Pemuda-Jakarta_Java.html,2,25,"2,075",Free Wifi Free parking ,False,0
25,property,      Erian Hotel,False,14168048,https://www.tripadvisor.com/Hotel_Review-g294229-d14168048-Reviews-Erian_Hotel-Jakarta_Java.html,67,26,"2,075",Free Wifi Free parking ,False,0
26,property,      Zodiak At Mt Haryono,False,6210773,https://www.tripadvisor.com/Hotel_Review-g294229-d6210773-Reviews-Zodiak_At_Mt_Haryono-Jakarta_Java.html,50,27,"2,075",Free Wifi Restaurant ,False,0
27,property,      Hotel Alma,False,2039236,https://www.tripadvisor.com/Hotel_Review-g294229-d2039236-Reviews-Hotel_Alma-Jakarta_Java.html,10,28,"2,075",Free Wifi Free parking ,False,0
28,property,      Grand Tropic Suites Hotel,False,673625,https://www.tripadvisor.com/Hotel_Review-g294229-d673625-Reviews-Grand_Tropic_Suites_Hotel-Jakarta_Java.html,261,29,"2,075",Free Wifi Pool ,False,0
29,property,      Kyriad Metro Cipulir Jakarta,False,13536370,https://www.tripadvisor.com/Hotel_Review-g294229-d13536370-Reviews-Kyriad_Metro_Cipulir_Jakarta-Jakarta_Java.html,12,30,"2,075",Free Wifi Free parking ,False,0
30,property,      Fairmont Jakarta,False,7182851,https://www.tripadvisor.com/Hotel_Review-g294229-d7182851-Reviews-Fairmont_Jakarta-Jakarta_Java.html,3143,31,"2,075",Free Wifi Free parking ,False,0
31,property,      Hotel Novotel Jakarta Gajah Mada,False,3588418,https://www.tripadvisor.com/Hotel_Review-g294229-d3588418-Reviews-Hotel_Novotel_Jakarta_Gajah_Mada-Jakarta_Java.html,2364,32,"2,075",Free Wifi Free parking ,False,0
32,property,      Raffles Jakarta,False,6897800,https://www.tripadvisor.com/Hotel_Review-g294229-d6897800-Reviews-Raffles_Jakarta-Jakarta_Java.html,1400,33,"2,075",Free Wifi Free parking ,False,0
33,property,      Century Park Hotel,False,450823,https://www.tripadvisor.com/Hotel_Review-g294229-d450823-Reviews-Century_Park_Hotel-Jakarta_Java.html,1516,34,"2,075",Free Wifi Free parking ,False,0
34,property,      The BnB Jakarta Kelapa Gading,False,4586354,https://www.tripadvisor.com/Hotel_Review-g294229-d4586354-Reviews-The_BnB_Jakarta_Kelapa_Gading-Jakarta_Java.html,269,35,"2,075",Free Wifi Free parking ,False,0
35,property,      HARRIS Vertu Hotel Harmoni,False,12034098,https://www.tripadvisor.com/Hotel_Review-g294229-d12034098-Reviews-HARRIS_Vertu_Hotel_Harmoni-Jakarta_Java.html,1956,36,"2,075",Free Wifi Free parking ,False,0
36,property,      DoubleTree by Hilton Hotel Jakarta - Diponegoro,False,5288357,https://www.tripadvisor.com/Hotel_Review-g294229-d5288357-Reviews-DoubleTree_by_Hilton_Hotel_Jakarta_Diponegoro-Jakarta_Java.html,1783,37,"2,075",Free parking Pool ,False,0
37,property,      Pullman Jakarta Indonesia,False,481832,https://www.tripadvisor.com/Hotel_Review-g294229-d481832-Reviews-Pullman_Jakarta_Indonesia-Jakarta_Java.html,3430,38,"2,075",Free Wifi Free parking ,False,0
38,property,      POP! Hotel Tebet Jakarta,False,5518272,https://www.tripadvisor.com/Hotel_Review-g294229-d5518272-Reviews-POP_Hotel_Tebet_Jakarta-Jakarta_Java.html,366,39,"2,075",Free Wifi Free parking ,False,0
39,property,      Hotel Zuri Express Mangga Dua,False,6762689,https://www.tripadvisor.com/Hotel_Review-g294229-d6762689-Reviews-Hotel_Zuri_Express_Mangga_Dua-Jakarta_Java.html,553,40,"2,075",Free Wifi Free parking ,False,0
40,property,      Mercure Jakarta Gatot Subroto,False,16866089,https://www.tripadvisor.com/Hotel_Review-g294229-d16866089-Reviews-Mercure_Jakarta_Gatot_Subroto-Jakarta_Java.html,154,41,"2,075",Free Wifi Free parking ,False,0
41,property,      Aryaduta Menteng,False,307133,https://www.tripadvisor.com/Hotel_Review-g294229-d307133-Reviews-Aryaduta_Menteng-Jakarta_Java.html,690,42,"2,075",Free Wifi Free parking ,False,0
42,property,      Liberta Hotel,False,3249664,https://www.tripadvisor.com/Hotel_Review-g294229-d3249664-Reviews-Liberta_Hotel-Jakarta_Java.html,395,43,"2,075",Free Wifi Free parking ,False,0
43,property,      Hotel Gran Mahakam Jakarta,False,299578,https://www.tripadvisor.com/Hotel_Review-g294229-d299578-Reviews-Hotel_Gran_Mahakam_Jakarta-Jakarta_Java.html,1051,44,"2,075",Free Wifi Pool ,False,0
44,property,      Swiss-Belhotel Pondok Indah,False,9589405,https://www.tripadvisor.com/Hotel_Review-g294229-d9589405-Reviews-Swiss_Belhotel_Pondok_Indah-Jakarta_Java.html,265,45,"2,075",Free Wifi Free parking ,False,0
45,property,      Hotel Menara Peninsula,False,482019,https://www.tripadvisor.com/Hotel_Review-g294229-d482019-Reviews-Hotel_Menara_Peninsula-Jakarta_Java.html,413,46,"2,075",Free Wifi Pool ,False,0
46,property,      Hotel Bidakara Grand Pancoran Jakarta,False,557849,https://www.tripadvisor.com/Hotel_Review-g294229-d557849-Reviews-Hotel_Bidakara_Grand_Pancoran_Jakarta-Jakarta_Java.html,154,47,"2,075",Free Wifi Free parking ,False,0
47,property,      Aryaduta Suites Semanggi,False,1477926,https://www.tripadvisor.com/Hotel_Review-g294229-d1477926-Reviews-Aryaduta_Suites_Semanggi-Jakarta_Java.html,452,48,"2,075",Free Wifi Free parking ,False,0
48,property,      favehotel LTC Glodok,False,5028648,https://www.tripadvisor.com/Hotel_Review-g294229-d5028648-Reviews-Favehotel_LTC_Glodok-Jakarta_Java.html,428,49,"2,075",Free Wifi Restaurant ,False,0
49,property,      Hotel Kuretakeso Kemang,False,15527441,https://www.tripadvisor.com/Hotel_Review-g294229-d15527441-Reviews-Hotel_Kuretakeso_Kemang-Jakarta_Java.html,52,50,"2,075",Free Wifi Free parking ,False,0
50,property,      Jambuluwuk Thamrin Hotel,False,19065704,https://www.tripadvisor.com/Hotel_Review-g294229-d19065704-Reviews-Jambuluwuk_Thamrin_Hotel-Jakarta_Java.html,19,51,"2,075",Free Wifi Free parking ,False,0
51,property,      Swiss-Belinn Simatupang,False,8591588,https://www.tripadvisor.com/Hotel_Review-g294229-d8591588-Reviews-Swiss_Belinn_Simatupang-Jakarta_Java.html,225,52,"2,075",Free Wifi Free parking ,False,0
52,property,      Arthama Hotel Wahid Hasyim Jakarta,False,17178363,https://www.tripadvisor.com/Hotel_Review-g294229-d17178363-Reviews-Arthama_Hotel_Wahid_Hasyim_Jakarta-Jakarta_Java.html,8,53,"2,075",Free parking Restaurant ,False,0
53,property,      Maple Hotel,False,12293306,https://www.tripadvisor.com/Hotel_Review-g294229-d12293306-Reviews-Maple_Hotel-Jakarta_Java.html,24,54,"2,075",Free Wifi Free parking ,False,0
54,property,      Oak Tree Mahakam Jakarta,False,4323730,https://www.tripadvisor.com/Hotel_Review-g294229-d4323730-Reviews-Oak_Tree_Mahakam_Jakarta-Jakarta_Java.html,68,55,"2,075",Free Wifi Free parking ,False,0
55,property,      RedDoorz @ Kelapa Dua Kebon Jeruk,False,9763732,https://www.tripadvisor.com/Hotel_Review-g294229-d9763732-Reviews-RedDoorz_Kelapa_Dua_Kebon_Jeruk-Jakarta_Java.html,6,56,"2,075",Free Wifi Free parking ,False,0
56,property,      Green Bamboo Residence,False,3323937,https://www.tripadvisor.com/Hotel_Review-g294229-d3323937-Reviews-Green_Bamboo_Residence-Jakarta_Java.html,32,57,"2,075",Free Wifi Restaurant ,False,0
57,property,      Clay Hotel Jakarta,False,3576927,https://www.tripadvisor.com/Hotel_Review-g294229-d3576927-Reviews-Clay_Hotel_Jakarta-Jakarta_Java.html,188,58,"2,075",Free Wifi Restaurant ,False,0
58,property,      Horison GP Mega Kuningan Hotel,False,5080546,https://www.tripadvisor.com/Hotel_Review-g294229-d5080546-Reviews-Horison_GP_Mega_Kuningan_Hotel-Jakarta_Java.html,96,59,"2,075",Free Wifi Pool ,False,0
59,property,      Samala Hotel,False,12295322,https://www.tripadvisor.com/Hotel_Review-g294229-d12295322-Reviews-Samala_Hotel-Jakarta_Java.html,59,60,"2,075",Free Wifi Free parking ,False,0
60,property,      Swissotel Jakarta PIK Avenue,False,18854425,https://www.tripadvisor.com/Hotel_Review-g294229-d18854425-Reviews-Swissotel_Jakarta_PIK_Avenue-Jakarta_Java.html,309,61,"2,075",Free Wifi Free parking ,False,0
61,property,      Morrissey Hotel Residences,False,1845751,https://www.tripadvisor.com/Hotel_Review-g294229-d1845751-Reviews-Morrissey_Hotel_Residences-Jakarta_Java.html,1254,62,"2,075",Free Wifi Free parking ,False,0
62,property,      Sentral Cawang Hotel,False,6776337,https://www.tripadvisor.com/Hotel_Review-g294229-d6776337-Reviews-Sentral_Cawang_Hotel-Jakarta_Java.html,378,63,"2,075",Free parking Restaurant ,False,0
63,property,      Ashley Jakarta Wahid Hasyim,False,11777162,https://www.tripadvisor.com/Hotel_Review-g294229-d11777162-Reviews-Ashley_Jakarta_Wahid_Hasyim-Jakarta_Java.html,399,64,"2,075",Free Wifi Free parking ,False,0
64,property,      Teraskita Hotel Jakarta Managed by Dafam,False,9454051,https://www.tripadvisor.com/Hotel_Review-g294229-d9454051-Reviews-Teraskita_Hotel_Jakarta_Managed_by_Dafam-Jakarta_Java.html,214,65,"2,075",Free Wifi Free parking ,False,0
65,property,      Ascott Kuningan Jakarta,False,6677774,https://www.tripadvisor.com/Hotel_Review-g294229-d6677774-Reviews-Ascott_Kuningan_Jakarta-Jakarta_Java.html,403,66,"2,075",Free Wifi Free parking ,False,0
66,property,      Park 5 Hotel,False,10224340,https://www.tripadvisor.com/Hotel_Review-g294229-d10224340-Reviews-Park_5_Hotel-Jakarta_Java.html,186,67,"2,075",Free Wifi Free parking ,False,0
67,property,      THE 1O1 Jakarta Sedayu Darmawangsa,False,7621601,https://www.tripadvisor.com/Hotel_Review-g294229-d7621601-Reviews-THE_1O1_Jakarta_Sedayu_Darmawangsa-Jakarta_Java.html,442,68,"2,075",Free Wifi Free parking ,False,0
68,property,      eL Royale Jakarta,False,13327668,https://www.tripadvisor.com/Hotel_Review-g294229-d13327668-Reviews-EL_Royale_Jakarta-Jakarta_Java.html,451,69,"2,075",Free Wifi Free parking ,False,0
69,property,      Yuan Garden Pasar Baru,False,13824534,https://www.tripadvisor.com/Hotel_Review-g294229-d13824534-Reviews-Yuan_Garden_Pasar_Baru-Jakarta_Java.html,914,70,"2,075",Free Wifi Free parking ,False,0
70,property,      Harper M.T. Haryono,False,10556987,https://www.tripadvisor.com/Hotel_Review-g294229-d10556987-Reviews-Harper_M_T_Haryono-Jakarta_Java.html,303,71,"2,075",,False,0
71,property,      Ashley Sabang,False,17517992,https://www.tripadvisor.com/Hotel_Review-g294229-d17517992-Reviews-Ashley_Sabang-Jakarta_Java.html,62,72,"2,075",Free Wifi Free parking ,False,0
72,property,      Citadines Rasuna Jakarta,False,4016337,https://www.tripadvisor.com/Hotel_Review-g294229-d4016337-Reviews-Citadines_Rasuna_Jakarta-Jakarta_Java.html,291,73,"2,075",Free Wifi Free parking ,False,0
73,property,      The Grove Suites,False,6538590,https://www.tripadvisor.com/Hotel_Review-g294229-d6538590-Reviews-The_Grove_Suites-Jakarta_Java.html,831,74,"2,075",Free Wifi Free parking ,False,0
74,property,      Cordela Hotel Senen,False,10620712,https://www.tripadvisor.com/Hotel_Review-g294229-d10620712-Reviews-Cordela_Hotel_Senen-Jakarta_Java.html,60,75,"2,075",Free Wifi Free parking ,False,0
75,property,      Verse Luxe Hotel Wahid Hasyim,False,12417943,https://www.tripadvisor.com/Hotel_Review-g294229-d12417943-Reviews-Verse_Luxe_Hotel_Wahid_Hasyim-Jakarta_Java.html,98,76,"2,075",Free Wifi Free parking ,False,0
76,property,      grandkemang Hotel,False,562541,https://www.tripadvisor.com/Hotel_Review-g294229-d562541-Reviews-Grandkemang_Hotel-Jakarta_Java.html,794,77,"2,075",Free Wifi Free parking ,False,0
77,property,      YELLO Hotel Manggarai,False,12214494,https://www.tripadvisor.com/Hotel_Review-g294229-d12214494-Reviews-YELLO_Hotel_Manggarai-Jakarta_Java.html,188,78,"2,075",Free Wifi Free parking ,False,0
78,property,      Diradja Hotel,False,6207104,https://www.tripadvisor.com/Hotel_Review-g294229-d6207104-Reviews-Diradja_Hotel-Jakarta_Java.html,70,79,"2,075",Free Wifi Restaurant ,False,0
79,property,      Kosenda Hotel,False,4798294,https://www.tripadvisor.com/Hotel_Review-g294229-d4798294-Reviews-Kosenda_Hotel-Jakarta_Java.html,669,80,"2,075",Free Wifi Free parking ,False,0
80,property,      Hotel NEO+ Kebayoran,False,12805469,https://www.tripadvisor.com/Hotel_Review-g294229-d12805469-Reviews-Hotel_NEO_Kebayoran-Jakarta_Java.html,102,81,"2,075",Free Wifi Free parking ,False,0
81,property,      Mega Anggrek Hotel,False,677224,https://www.tripadvisor.com/Hotel_Review-g294229-d677224-Reviews-Mega_Anggrek_Hotel-Jakarta_Java.html,113,82,"2,075",Free Wifi Pool ,False,0
82,property,      D'Primahotel Airport Jakarta II,False,15327587,https://www.tripadvisor.com/Hotel_Review-g15332542-d15327587-Reviews-D_Primahotel_Airport_Jakarta_II-Pegadungan_Jakarta_Java.html,10,83,"2,075",Free Wifi Free parking ,False,0
83,property,      Park Regis Arion,False,634502,https://www.tripadvisor.com/Hotel_Review-g294229-d634502-Reviews-Park_Regis_Arion-Jakarta_Java.html,254,84,"2,075",Free Wifi Free parking ,False,0
84,property,      HARRIS Suites FX Sudirman,False,2051622,https://www.tripadvisor.com/Hotel_Review-g294229-d2051622-Reviews-HARRIS_Suites_FX_Sudirman-Jakarta_Java.html,962,85,"2,075",Free Wifi Free parking ,False,0
85,property,      Little Amaroossa Residence,False,7186577,https://www.tripadvisor.com/Hotel_Review-g294229-d7186577-Reviews-Little_Amaroossa_Residence-Jakarta_Java.html,134,86,"2,075",Free Wifi ,False,0
86,property,      Manhattan Hotel,False,632901,https://www.tripadvisor.com/Hotel_Review-g294229-d632901-Reviews-Manhattan_Hotel-Jakarta_Java.html,555,87,"2,075",Free Wifi Pool ,False,0
87,property,      Citi M Hotel,False,5212027,https://www.tripadvisor.com/Hotel_Review-g294229-d5212027-Reviews-Citi_M_Hotel-Jakarta_Java.html,459,88,"2,075",Free Wifi Free parking ,False,0
88,property,      RedDoorz Plus @ Thamrin,False,11869438,https://www.tripadvisor.com/Hotel_Review-g294229-d11869438-Reviews-RedDoorz_Plus_Thamrin-Jakarta_Java.html,18,89,"2,075",Free Wifi Restaurant ,False,0
89,property,      OYO Flagship 210 Amethyst Kemayoran,False,17386806,https://www.tripadvisor.com/Hotel_Review-g294229-d17386806-Reviews-OYO_Flagship_210_Amethyst_Kemayoran-Jakarta_Java.html,1,90,"2,075",Free Wifi Free parking ,False,0
90,property,      The Westin Jakarta,False,10391433,https://www.tripadvisor.com/Hotel_Review-g294229-d10391433-Reviews-The_Westin_Jakarta-Jakarta_Java.html,704,91,"2,075",Free Wifi Free parking ,False,0
91,property,      Fraser Residence Menteng Jakarta,False,4913622,https://www.tripadvisor.com/Hotel_Review-g294229-d4913622-Reviews-Fraser_Residence_Menteng_Jakarta-Jakarta_Java.html,263,92,"2,075",Free Wifi Free parking ,False,0
92,property,      Aston Rasuna,False,582032,https://www.tripadvisor.com/Hotel_Review-g294229-d582032-Reviews-Aston_Rasuna-Jakarta_Java.html,983,93,"2,075",Free Wifi Free parking ,False,0
93,property,      Grand Hyatt Jakarta,False,307132,https://www.tripadvisor.com/Hotel_Review-g294229-d307132-Reviews-Grand_Hyatt_Jakarta-Jakarta_Java.html,1596,94,"2,075",Free Wifi Pool ,False,0
94,property,      Sari Pacific Jakarta,False,301917,https://www.tripadvisor.com/Hotel_Review-g294229-d301917-Reviews-Sari_Pacific_Jakarta-Jakarta_Java.html,996,95,"2,075",Free Wifi Free parking ,False,0
95,property,      Ambhara Hotel Jakarta,False,551022,https://www.tripadvisor.com/Hotel_Review-g294229-d551022-Reviews-Ambhara_Hotel_Jakarta-Jakarta_Java.html,276,96,"2,075",Free Wifi Free parking ,False,0
96,property,      The Sultan Hotel & Residence Jakarta,False,307124,https://www.tripadvisor.com/Hotel_Review-g294229-d307124-Reviews-The_Sultan_Hotel_Residence_Jakarta-Jakarta_Java.html,990,97,"2,075",Free Wifi Free parking ,False,0
97,property,      Mandarin Oriental Jakarta,False,301415,https://www.tripadvisor.com/Hotel_Review-g294229-d301415-Reviews-Mandarin_Oriental_Jakarta-Jakarta_Java.html,2728,98,"2,075",Free Wifi Pool ,False,0
98,property,      Best Western Premier The Hive,False,6887893,https://www.tripadvisor.com/Hotel_Review-g294229-d6887893-Reviews-Best_Western_Premier_The_Hive-Jakarta_Java.html,404,99,"2,075",Free Wifi Free parking ,False,0
99,property,      Sawana Suites,False,10006002,https://www.tripadvisor.com/Hotel_Review-g294229-d10006002-Reviews-Sawana_Suites-Jakarta_Java.html,120,100,"2,075",Free Wifi Free parking ,False,0
100,property,      The Gunawarman,False,10767891,https://www.tripadvisor.com/Hotel_Review-g294229-d10767891-Reviews-The_Gunawarman-Jakarta_Java.html,156,101,"2,075",Free Wifi Free parking ,False,0
101,property,      Merlynn Park Hotel,False,1799977,https://www.tripadvisor.com/Hotel_Review-g294229-d1799977-Reviews-Merlynn_Park_Hotel-Jakarta_Java.html,393,102,"2,075",Free Wifi Pool ,False,0
102,property,      Mercure Jakarta Simatupang,False,3484872,https://www.tripadvisor.com/Hotel_Review-g294229-d3484872-Reviews-Mercure_Jakarta_Simatupang-Jakarta_Java.html,657,103,"2,075",Free Wifi Free parking ,False,0
103,property,      Hotel Neo Mangga Dua Square,False,5039765,https://www.tripadvisor.com/Hotel_Review-g294229-d5039765-Reviews-Hotel_Neo_Mangga_Dua_Square-Jakarta_Java.html,507,104,"2,075",Free Wifi Free parking ,False,0
104,property,      ASTON Bellevue Radio Dalam,False,7808040,https://www.tripadvisor.com/Hotel_Review-g294229-d7808040-Reviews-ASTON_Bellevue_Radio_Dalam-Jakarta_Java.html,126,105,"2,075",Free Wifi Free parking ,False,0
105,property,      Bold Hotel Jakarta,False,10519939,https://www.tripadvisor.com/Hotel_Review-g294229-d10519939-Reviews-Bold_Hotel_Jakarta-Jakarta_Java.html,45,106,"2,075",Free Wifi Free parking ,False,0
106,property,      Fraser Place Setiabudi,False,9589459,https://www.tripadvisor.com/Hotel_Review-g294229-d9589459-Reviews-Fraser_Place_Setiabudi-Jakarta_Java.html,149,107,"2,075",Free Wifi Free parking ,False,0
107,property,      D'primahotel WTC  Mangga Dua,False,4341140,https://www.tripadvisor.com/Hotel_Review-g294229-d4341140-Reviews-D_primahotel_WTC_Mangga_Dua-Jakarta_Java.html,51,108,"2,075",Free Wifi ,False,0
108,property,      Veranda Serviced Residence Puri,False,14985497,https://www.tripadvisor.com/Hotel_Review-g294229-d14985497-Reviews-Veranda_Serviced_Residence_Puri-Jakarta_Java.html,9,109,"2,075",Restaurant ,False,0
109,property,      White Tree Residence,False,12358007,https://www.tripadvisor.com/Hotel_Review-g294229-d12358007-Reviews-White_Tree_Residence-Jakarta_Java.html,11,110,"2,075",Free Wifi Free parking ,False,0
110,property,      Casa Living Senayan,False,17508683,https://www.tripadvisor.com/Hotel_Review-g294229-d17508683-Reviews-Casa_Living_Senayan-Jakarta_Java.html,4,111,"2,075",,False,0
111,property,      Holiday Inn Express Jakarta Pluit Citygate,False,4766280,https://www.tripadvisor.com/Hotel_Review-g294229-d4766280-Reviews-Holiday_Inn_Express_Jakarta_Pluit_Citygate-Jakarta_Java.html,427,112,"2,075",Free Wifi Restaurant ,False,0
112,property,      Goodrich Suites by Artotel,False,13984936,https://www.tripadvisor.com/Hotel_Review-g294229-d13984936-Reviews-Goodrich_Suites_by_Artotel-Jakarta_Java.html,46,113,"2,075",Free Wifi Free parking ,False,0
113,property,      Hotel Kristal Jakarta,False,557846,https://www.tripadvisor.com/Hotel_Review-g294229-d557846-Reviews-Hotel_Kristal_Jakarta-Jakarta_Java.html,394,114,"2,075",Free Wifi Free parking ,False,0
114,property,      favehotel PGC Cililitan,False,5039646,https://www.tripadvisor.com/Hotel_Review-g294229-d5039646-Reviews-Favehotel_PGC_Cililitan-Jakarta_Java.html,349,115,"2,075",Free Wifi Free parking ,False,0
115,property,      Belvena Hotel,False,3186545,https://www.tripadvisor.com/Hotel_Review-g294229-d3186545-Reviews-Belvena_Hotel-Jakarta_Java.html,7,116,"2,075",Free Wifi Restaurant ,False,0
116,property,      Smart Hotel Thamrin Jakarta,False,1952999,https://www.tripadvisor.com/Hotel_Review-g294229-d1952999-Reviews-Smart_Hotel_Thamrin_Jakarta-Jakarta_Java.html,130,117,"2,075",Free Wifi Restaurant ,False,0
117,property,      Rivoli Hotel,False,12966204,https://www.tripadvisor.com/Hotel_Review-g294229-d12966204-Reviews-Rivoli_Hotel-Jakarta_Java.html,31,118,"2,075",Restaurant ,False,0
118,property,      Business Hotel Tomang,False,5518267,https://www.tripadvisor.com/Hotel_Review-g294229-d5518267-Reviews-Business_Hotel_Tomang-Jakarta_Java.html,41,119,"2,075",Free Wifi Restaurant ,False,0
119,property,      Hotel Horison Ciledug Jakarta,False,13387614,https://www.tripadvisor.com/Hotel_Review-g294229-d13387614-Reviews-Hotel_Horison_Ciledug_Jakarta-Jakarta_Java.html,608,120,"2,075",Free Wifi Free parking ,False,0
120,property,      Stanley Wahid Hasyim,False,19274462,https://www.tripadvisor.com/Hotel_Review-g294229-d19274462-Reviews-Stanley_Wahid_Hasyim-Jakarta_Java.html,102,121,"2,075",Free Wifi Free parking ,False,0
121,property,      Aston Pluit Hotel & Residence,False,3199516,https://www.tripadvisor.com/Hotel_Review-g294229-d3199516-Reviews-Aston_Pluit_Hotel_Residence-Jakarta_Java.html,1705,122,"2,075",Free Wifi Free parking ,False,0
